{"schema_version":"1.0.0","profile_id":"synthetic-f03","device":{"manufacturer":"PanBeat","model":"Synthetic MIDI"},"settings":{"tone":"synthetic","style":"test"},"unknown_policy":"diagnostic","deduplication":{"mode":"none","window_us":0,"signature_fields":[],"reason":"Synthetic fixture has no duplicate source events."},"mappings":[{"channel_wire":0,"note":60,"velocity_min":1,"velocity_max":127,"technique":"tone","target_id":"tone-1"},{"channel_wire":0,"note":61,"velocity_min":1,"velocity_max":127,"technique":"ding","target_id":"ding"},{"channel_wire":0,"note":62,"velocity_min":1,"velocity_max":127,"technique":"slap","target_id":"outer-hit-radius"}]}
